{
  "learner_id": "jeff",
  "current_phase_id": "P01",
  "current_module_id": "P01-M02",
  "current_lesson_id": "P01-M02-L01",
  "last_updated": "2025-12-13T00:00:00Z",
  "notes": "Lesson P01-M02-L01 (Git Branching Fundamentals) completed with exceptional performance. Identified curriculum structure issues and proposed system-wide improvements. Ready for Architect role to address structural refactoring before continuing to P01-M02-L02."
}
